iliad,15,657,DDDDDA,ἁθρόοι οὐδὲ κέδασθεν ,ἀνὰ στρατόν ἴσχε γὰρ αἰδὼς
iliad,15,658,DSDDSA,καὶ δέος ἀζηχὲς ,γὰρ ὁμόκλεον ἀλλήλοισι
iliad,15,659,SDDDDA,νέστωρ αὖτε μάλιστα ,γερήνιος οὖρος ἀχαιῶν
iliad,15,660,DDSDDA,λίσσεθ ὑπὲρ τοκέων ,γουνούμενος ἄνδρα ἕκαστον
iliad,15,661,DDDSDA,‘ὦ φίλοι ἀνέρες ἔστε ,καὶ αἰδῶ θέσθ ἐνὶ θυμῷ
iliad,15,662,SSDSDA,ἄλλων ἀνθρώπων ,ἐπὶ δὲ μνήσασθε ἕκαστος
iliad,15,663,SDSDDA,παίδων ἠδ ἀλόχων ,καὶ κτήσιος ἠδὲ τοκήων
iliad,15,664,DSDDSA,ἠμὲν ὅτεῳ ζώουσι ,καὶ ᾧ κατατεθνήκασι
iliad,15,665,DDSDDA,τῶν ὕπερ ἐνθάδ ἐγὼ ,γουνάζομαι οὐ παρεόντων
iliad,15,666,DDSSDA,ἑστάμεναι κρατερῶς ,μὴ δὲ τρωπᾶσθε φόβον δέ
iliad,15,667,SSDSDA,ὣς εἰπὼν ὄτρυνε ,μένος καὶ θυμὸν ἑκάστου
iliad,15,668,DSDDDA,τοῖσι δ ἀπ ὀφθαλμῶν ,νέφος ἀχλύος ὦσεν ἀθήνη
iliad,15,669,DDDDDA,θεσπέσιον μάλα δέ ,σφι φόως γένετ ἀμφοτέρωθεν
iliad,15,670,SSDSDA,ἠμὲν πρὸς νηῶν ,καὶ ὁμοιΐου πολέμοιο
iliad,15,671,DSDDDA,ἕκτορα δὲ φράσσαντο ,βοὴν ἀγαθὸν καὶ ἑταίρους
iliad,15,672,DDDDDA,ἠμὲν ὅσοι μετόπισθεν ,ἀφέστασαν οὐδὲ μάχοντο
iliad,15,673,SDDDDA,ἠδ ὅσσοι παρὰ νηυσὶ ,μάχην ἐμάχοντο θοῇσιν
iliad,15,674,DSDDDA,οὐδ ἄρ ἔτ αἴαντι ,μεγαλήτορι ἥνδανε θυμῷ
iliad,15,675,DDDDDA,ἑστάμεν ἔνθά περ ἄλλοι ,ἀφέστασαν υἷες ἀχαιῶν
iliad,15,676,DSDDDA,ἀλλ ὅ γε νηῶν ἴκρι ,ἐπῴχετο μακρὰ βιβάσθων
iliad,15,677,SSDDDA,νώμα δὲ ξυστὸν ,μέγα ναύμαχον ἐν παλάμῃσι
iliad,15,678,SSDSDA,κολλητὸν βλήτροισι ,δυωκαιεικοσίπηχυ
iliad,15,679,DSDSDA,ὡς δ ὅτ ἀνὴρ ἵπποισι ,κελητίζειν ἐῢ εἰδώς
iliad,15,680,DDDDDA,ὅς τ ἐπεὶ ἐκ πολέων ,πίσυρας συναείρεται ἵππους
iliad,15,681,SDDDDA,σεύας ἐκ πεδίοιο ,μέγα προτὶ ἄστυ δίηται
iliad,15,682,DDDDSA,λαοφόρον καθ ὁδόν ,πολέες τέ ἑ θηήσαντο
iliad,15,683,DDDDDA,ἀνέρες ἠδὲ γυναῖκες ,ὃ δ ἔμπεδον ἀσφαλὲς αἰεὶ
iliad,15,684,SDDDDA,θρῴσκων ἄλλοτ ἐπ ἄλλον ,ἀμείβεται οἳ δὲ πέτονται
iliad,15,685,SDDSDA,‘ὣς αἴας ἐπὶ πολλὰ ,θοάων ἴκρια νηῶν
iliad,15,686,SDSDDA,φοίτα μακρὰ βιβάς ,φωνὴ δέ οἱ αἰθέρ ἵκανεν
iliad,15,687,SSDDDA,αἰεὶ δὲ σμερδνὸν ,βοόων δαναοῖσι κέλευε
iliad,15,688,DDDDDA,νηυσί τε καὶ κλισίῃσιν ,ἀμυνέμεν οὐδὲ μὲν ἕκτωρ
iliad,15,689,DSDDSA,μίμνεν ἐνὶ τρώων ,ὁμάδῳ πύκα θωρηκτάων
iliad,15,690,SSDSDA,ἀλλ ὥς τ ὀρνίθων ,πετεηνῶν αἰετὸς αἴθων
iliad,15,691,DSDDDA,ἔθνος ἐφορμᾶται ,ποταμὸν πάρα βοσκομενάων
iliad,15,692,SDSSDA,χηνῶν ἢ γεράνων ,ἢ κύκνων δουλιχοδείρων
iliad,15,693,SSDDSA,ὣς ἕκτωρ ἴθυσε ,νεὸς κυανοπρῴροιο
iliad,15,694,DSSSDA,ἀντίος ἀΐξας ,τὸν δὲ ζεὺς ὦσεν ὄπισθε
iliad,15,695,SDDDDA,χειρὶ μάλα μεγάλῃ ,ὄτρυνε δὲ λαὸν ἅμ αὐτῷ
iliad,15,696,SSDDDA,αὖτις δὲ δριμεῖα ,μάχη παρὰ νηυσὶν ἐτύχθη
iliad,15,697,SSDDSA,φαίης κ ἀκμῆτας ,καὶ ἀτειρέας ἀλλήλοισιν
iliad,15,698,SDSDDA,ἄντεσθ ἐν πολέμῳ ,ὡς ἐσσυμένως ἐμάχοντο
iliad,15,699,DDDDDA,τοῖσι δὲ μαρναμένοισιν ,ὅδ ἦν νόος ἤτοι ἀχαιοὶ
iliad,15,700,DSDDDA,οὐκ ἔφασαν φεύξεσθαι ,ὑπ ἐκ κακοῦ ἀλλ ὀλέεσθαι
iliad,15,701,SDDSDA,τρωσὶν δ ἔλπετο θυμὸς ,ἐνὶ στήθεσσιν ἑκάστου
iliad,15,702,DSDSDA,νῆας ἐνιπρήσειν ,κτενέειν θ ἥρωας ἀχαιούς
iliad,15,703,SDDDSA,οἳ μὲν τὰ φρονέοντες ,ἐφέστασαν ἀλλήλοισιν
iliad,15,704,SSDDDA,ἕκτωρ δὲ πρυμνῆς ,νεὸς ἥψατο ποντοπόροιο
iliad,15,705,SDSDDA,καλῆς ὠκυάλου ,ἣ πρωτεσίλαον ἔνεικεν
iliad,15,706,SSDDDA,ἐς τροίην οὐδ αὖτις ,ἀπήγαγε πατρίδα γαῖαν
iliad,15,707,SDDSSA,τοῦ περ δὴ περὶ νηὸς ,ἀχαιοί τε τρῶές τε
iliad,15,708,SSSDDA,δῄουν ἀλλήλους ,αὐτοσχεδόν οὐδ ἄρα τοί γε
iliad,15,709,SSSDDA,τόξων ἀϊκὰς ,ἀμφὶς μένον οὐδ ἔτ ἀκόντων
iliad,15,710,SDDDDA,ἀλλ οἵ γ ἐγγύθεν ἱστάμενοι ,ἕνα θυμὸν ἔχοντες
iliad,15,711,DDDSDA,ὀξέσι δὴ πελέκεσσι ,καὶ ἀξίνῃσι μάχοντο
iliad,15,712,DDDDDA,καὶ ξίφεσιν μεγάλοισι ,καὶ ἔγχεσιν ἀμφιγύοισι
iliad,15,713,DDDDSA,πολλὰ δὲ φάσγανα καλὰ ,μελάνδετα κωπήεντα
iliad,15,714,DSDDDA,ἄλλα μὲν ἐκ χειρῶν ,χαμάδις πέσον ἄλλα δ ἀπ ὤμων
iliad,15,715,SDDDDA,ἀνδρῶν μαρναμένων ,ῥέε δ αἵματι γαῖα μέλαινα
iliad,15,716,SSDDDA,ἕκτωρ δὲ πρύμνηθεν ,ἐπεὶ λάβεν οὐχὶ μεθίει
iliad,15,717,SDDSDA,ἄφλαστον μετὰ χερσὶν ,ἔχων τρωσὶν δὲ κέλευεν
iliad,15,718,DDDDDA,οἴσετε πῦρ ἅμα δ αὐτοὶ ,ἀολλέες ὄρνυτ ἀϋτήν
iliad,15,719,SSSDDA,νῦν ἡμῖν πάντων ,ζεὺς ἄξιον ἦμαρ ἔδωκε
iliad,15,720,DSDDDA,νῆας ἑλεῖν αἳ δεῦρο ,θεῶν ἀέκητι μολοῦσαι
iliad,15,721,SDDDDA,ἡμῖν πήματα πολλὰ ,θέσαν κακότητι γερόντων
iliad,15,722,DDDSDA,οἵ μ ἐθέλοντα μάχεσθαι ,ἐπὶ πρυμνῇσι νέεσσιν
iliad,15,723,SDDSDA,αὐτόν τ ἰσχανάασκον ,ἐρητύοντό τε λαόν
iliad,15,724,SDSDDA,ἀλλ εἰ δή ῥα τότε ,βλάπτε φρένας εὐρύοπα ζεὺς
iliad,15,725,DSDSDA,ἡμετέρας νῦν αὐτὸς ,ἐποτρύνει καὶ ἀνώγει
iliad,15,726,DDDSDA,ὣς ἔφαθ οἳ δ ἄρα μᾶλλον ,ἐπ ἀργείοισιν ὄρουσαν
iliad,15,727,SDDDDA,αἴας δ οὐκέτ ἔμιμνε ,βιάζετο γὰρ βελέεσσιν
iliad,15,728,DDDDDA,ἀλλ ἀνεχάζετο τυτθόν ,ὀϊόμενος θανέεσθαι
iliad,15,729,DDDDDA,θρῆνυν ἐφ ἑπταπόδην ,λίπε δ ἴκρια νηὸς ἐΐσης
iliad,15,730,DSDDDA,ἔνθ ἄρ ὅ γ ἑστήκει ,δεδοκημένος ἔγχεϊ δ αἰεὶ
iliad,15,731,DDSDDA,τρῶας ἄμυνε νεῶν ,ὅς τις φέροι ἀκάματον πῦρ
iliad,15,732,SSDDDA,αἰεὶ δὲ σμερδνὸν ,βοόων δαναοῖσι κέλευε
iliad,15,733,DSDDDA,‘ὦ φίλοι ἥρωες ,δαναοὶ θεράποντες ἄρηος
iliad,15,734,DDSDDA,ἀνέρες ἔστε φίλοι ,μνήσασθε δὲ θούριδος ἀλκῆς
iliad,15,735,DDDSDA,ἠέ τινάς φαμεν εἶναι ,ἀοσσητῆρας ὀπίσσω
iliad,15,736,DDDDDA,ἦέ τι τεῖχος ἄρειον ,ὅ κ ἀνδράσι λοιγὸν ἀμύναι
iliad,15,737,SDDSDA,οὐ μέν τι σχεδόν ἐστι ,πόλις πύργοις ἀραρυῖα
iliad,15,738,DSDDDA,ᾗ κ ἀπαμυναίμεσθ ,ἑτεραλκέα δῆμον ἔχοντες
iliad,15,739,SSDDSA,ἀλλ ἐν γὰρ τρώων ,πεδίῳ πύκα θωρηκτάων
iliad,15,740,SDDDDA,πόντῳ κεκλιμένοι ,ἑκὰς ἥμεθα πατρίδος αἴης
iliad,15,741,SDSDDA,τὼ ἐν χερσὶ φόως ,οὐ μειλιχίῃ πολέμοιο
iliad,15,742,SSDDDA,ἦ καὶ μαιμώων ,ἔφεπ ἔγχεϊ ὀξυόεντι
iliad,15,743,SSSDDA,ὅς τις δὲ τρώων ,κοίλῃς ἐπὶ νηυσὶ φέροιτο
iliad,15,744,DSDDSA,σὺν πυρὶ κηλείῳ ,χάριν ἕκτορος ὀτρύναντος
iliad,15,745,SSDDDA,τὸν δ αἴας οὔτασκε ,δεδεγμένος ἔγχεϊ μακρῷ
iliad,15,746,DDDSDA,δώδεκα δὲ προπάροιθε ,νεῶν αὐτοσχεδὸν οὖτα
