iliad,20,440,DSDDDA,ἦκα μάλα ψύξασα ,τὸ δ ἂψ ἵκεθ ἕκτορα δῖον
iliad,20,441,SDDDDA,αὐτοῦ δὲ προπάροιθε ,ποδῶν πέσεν αὐτὰρ ἀχιλλεὺς
iliad,20,442,DDDDDA,ἐμμεμαὼς ἐπόρουσε ,κατακτάμεναι μενεαίνων
iliad,20,443,DDSSDA,σμερδαλέα ἰάχων ,τὸν δ ἐξήρπαξεν ἀπόλλων
iliad,20,444,DDDDDA,ῥεῖα μάλ ὥς τε θεός ,ἐκάλυψε δ ἄρ ἠέρι πολλῇ
iliad,20,445,DDDSDA,τρὶς μὲν ἔπειτ ἐπόρουσε ,ποδάρκης δῖος ἀχιλλεὺς
iliad,20,446,DSSDDA,ἔγχεϊ χαλκείῳ ,τρὶς δ ἠέρα τύψε βαθεῖαν
iliad,20,447,DDDDDA,ἀλλ ὅτε δὴ τὸ τέταρτον ,ἐπέσσυτο δαίμονι ἶσος
iliad,20,448,DSDDDA,δεινὰ δ ὁμοκλήσας ,ἔπεα πτερόεντα προσηύδα
iliad,20,449,SDDDDA,‘ἐξ αὖ νῦν ἔφυγες ,θάνατον κύον ἦ τέ τοι ἄγχι
iliad,20,450,DSDDDA,ἦλθε κακόν νῦν αὖτέ ,σ ἐρύσατο φοῖβος ἀπόλλων
iliad,20,451,SSDSDA,ᾧ μέλλεις εὔχεσθαι ,ἰὼν ἐς δοῦπον ἀκόντων
iliad,20,452,SDDDDA,ἦ θήν σ ἐξανύω ,γε καὶ ὕστερον ἀντιβολήσας
iliad,20,453,SDDDDA,εἴ πού τις καὶ ἔμοιγε ,θεῶν ἐπιτάρροθός ἐστι
iliad,20,454,SSDDDA,νῦν αὖ τοὺς ἄλλους ,ἐπιείσομαι ὅν κε κιχείω
iliad,20,455,SDDDDA,ὣς εἰπὼν δρύοπ οὖτα ,κατ αὐχένα μέσσον ἄκοντι
iliad,20,456,DDDDDA,ἤριπε δὲ προπάροιθε ,ποδῶν ὃ δὲ τὸν μὲν ἔασε
iliad,20,457,SDDSDA,δημοῦχον δὲ φιλητορίδην ,ἠΰν τε μέγαν τε
iliad,20,458,DDSDDA,κὰγ γόνυ δουρὶ βαλὼν ,ἠρύκακε τὸν μὲν ἔπειτα
iliad,20,459,SDDSDA,οὐτάζων ξίφεϊ ,μεγάλῳ ἐξαίνυτο θυμόν
iliad,20,460,DDSDDA,αὐτὰρ ὃ λαόγονον ,καὶ δάρδανον υἷε βίαντος
iliad,20,461,DSSSDA,ἄμφω ἐφορμηθεὶς ,ἐξ ἵππων ὦσε χαμᾶζε
iliad,20,462,SDSDDA,τὸν μὲν δουρὶ βαλών ,τὸν δὲ σχεδὸν ἄορι τύψας
iliad,20,463,DDDDDA,τρῶα δ ἀλαστορίδην ,ὃ μὲν ἀντίος ἤλυθε γούνων
iliad,20,464,SDDSDA,εἴ πώς εὑ πεφίδοιτο ,λαβὼν καὶ ζωὸν ἀφείη
iliad,20,465,DSDDDA,μηδὲ κατακτείνειεν ,ὁμηλικίην ἐλεήσας
iliad,20,466,DDDSDA,νήπιος οὐδὲ τὸ ᾔδη ,ὃ οὐ πείσεσθαι ἔμελλεν
iliad,20,467,SDDSDA,οὐ γάρ τι γλυκύθυμος ,ἀνὴρ ἦν οὐδ ἀγανόφρων
iliad,20,468,DDDDDA,ἀλλὰ μάλ ἐμμεμαώς ,ὃ μὲν ἥπτετο χείρεσι γούνων
iliad,20,469,DSDDDA,ἱέμενος λίσσεσθ ,ὃ δὲ φασγάνῳ οὖτα καθ ἧπαρ
iliad,20,470,DDDDDA,ἐκ δέ οἱ ἧπαρ ὄλισθεν ,ἀτὰρ μέλαν αἷμα κατ αὐτοῦ
iliad,20,471,DSSDDA,κόλπον ἐνέπλησεν ,τὸν δὲ σκότος ὄσσε κάλυψε
iliad,20,472,SDDDDA,θυμοῦ δευόμενον ,ὃ δὲ μούλιον οὖτα παραστὰς
iliad,20,473,DSDDDA,δουρὶ κατ οὖς εἶθαρ ,δὲ δι οὔατος ἦλθ ἑτέροιο
iliad,20,474,SSDDDA,αἰχμὴ χαλκείη ,ὃ δ ἀγήνορος υἱὸν ἔχεκλον
iliad,20,475,SDDDSA,μέσσην κὰκ κεφαλὴν ,ξίφει ἤλασε κωπήεντι
iliad,20,476,DSDDDA,πᾶν δ ὑπεθερμάνθη ,ξίφος αἵματι τὸν δὲ κατ ὄσσε
iliad,20,477,DDDSDA,ἔλλαβε πορφύρεος ,θάνατος καὶ μοῖρα κραταιή
iliad,20,478,DDDDDA,δευκαλίωνα δ ἔπειθ ,ἵνα τε ξυνέχουσι τένοντες
iliad,20,479,SSDDDA,ἀγκῶνος τῇ τόν ,γε φίλης διὰ χειρὸς ἔπειρεν
iliad,20,480,SSDDDA,αἰχμῇ χαλκείῃ ,ὃ δέ μιν μένε χεῖρα βαρυνθεὶς
iliad,20,481,DDDDDA,πρόσθ ὁρόων θάνατον ,ὃ δὲ φασγάνῳ αὐχένα θείνας
iliad,20,482,SSDDDA,τῆλ αὐτῇ πήληκι ,κάρη βάλε μυελὸς αὖτε
iliad,20,483,DSDDDA,σφονδυλίων ἔκπαλθ ,ὃ δ ἐπὶ χθονὶ κεῖτο τανυσθείς
iliad,20,484,DDDDDA,αὐτὰρ ὃ βῆ ῥ ἰέναι ,μετ ἀμύμονα πείρεω υἱὸν
iliad,20,485,DSDDSA,ῥίγμον ὃς ἐκ θρῄκης ,ἐριβώλακος εἰληλούθει
iliad,20,486,DDDSDA,τὸν βάλε μέσσον ἄκοντι ,πάγη δ ἐν νηδύϊ χαλκός
iliad,20,487,DDDDDA,ἤριπε δ ἐξ ὀχέων ,ὃ δ ἀρηΐθοον θεράποντα
iliad,20,488,SSDDDA,ἂψ ἵππους στρέψαντα ,μετάφρενον ὀξέϊ δουρὶ
iliad,20,489,DDDSDA,νύξ ἀπὸ δ ἅρματος ὦσε ,κυκήθησαν δέ οἱ ἵπποι
iliad,20,490,DSDDDA,ὡς δ ἀναμαιμάει ,βαθέ ἄγκεα θεσπιδαὲς πῦρ
iliad,20,491,DDDDDA,οὔρεος ἀζαλέοιο ,βαθεῖα δὲ καίεται ὕλη
iliad,20,492,SDDDSA,πάντῃ τε κλονέων ,ἄνεμος φλόγα εἰλυφάζει
iliad,20,493,DSDDDA,ὣς ὅ γε πάντῃ θῦνε ,σὺν ἔγχεϊ δαίμονι ἶσος
iliad,20,494,DDDDDA,κτεινομένους ἐφέπων ,ῥέε δ αἵματι γαῖα μέλαινα
iliad,20,495,DSDDDA,ὡς δ ὅτε τις ζεύξῃ ,βόας ἄρσενας εὐρυμετώπους
iliad,20,496,DSDDDA,τριβέμεναι κρῖ λευκὸν ,ἐϋκτιμένῃ ἐν ἀλωῇ
iliad,20,497,DDDDDA,ῥίμφά τε λέπτ ἐγένοντο ,βοῶν ὑπὸ πόσσ ἐριμύκων
iliad,20,498,DSDSDA,ὣς ὑπ ἀχιλλῆος ,μεγαθύμου μώνυχες ἵπποι
iliad,20,499,DDDDDA,στεῖβον ὁμοῦ νέκυάς ,τε καὶ ἀσπίδας αἵματι δ ἄξων
iliad,20,500,DDDDDA,νέρθεν ἅπας πεπάλακτο ,καὶ ἄντυγες αἳ περὶ δίφρον
iliad,20,501,DSSDDA,ἃς ἄρ ἀφ ἱππείων ,ὁπλέων ῥαθάμιγγες ἔβαλλον
iliad,20,502,DSDDDA,αἵ τ ἀπ ἐπισσώτρων ,ὃ δὲ ἵετο κῦδος ἀρέσθαι
iliad,20,503,DSDDDA,πηλεΐδης λύθρῳ ,δὲ παλάσσετο χεῖρας ἀάπτους
